{
  "schemaVersion": 1,
  "id": "foldrajz-kozep-2026-majus-minta",
  "subject": "foldrajz",
  "level": "kozep",
  "year": 2026,
  "session": "majus",
  "format": "2024",
  "title": "Mintafeladatsor – Földrajz, középszint",
  "sample": true,
  "maxPoints": 14,
  "source": {
    "publisher": "Érettségi Gyakorló (saját mintafeladatsor)",
    "examPdf": {
      "file": "feladatlap.pdf",
      "sha256": "986eb5a8c925d429eacda616255878533376f131bc9ded096a4bd0db02a13842",
      "pages": 3,
      "label": "Feladatlap"
    }
  },
  "parts": [
    {
      "id": "I",
      "title": "I. feladatlap (topográfia)",
      "timeLimitMinutes": 20,
      "maxPoints": 3,
      "instructions": "Az I. feladatlap megoldásához atlasz és egyéb segédeszköz nem használható. Több válasz beírása esetén az adott kérdésre nem jár pont.",
      "tasks": [
        {
          "id": "I-1",
          "number": "1.",
          "type": "short_answer",
          "text": "Nevezze meg a földrajzi neveket!",
          "maxPoints": 3,
          "topics": [
            "topográfia",
            "Magyarország"
          ],
          "fields": [
            {
              "id": "I-1-f1",
              "kind": "text",
              "label": "a) Magyarország legmagasabb pontja (hegycsúcs):",
              "pdfRect": {
                "page": 1,
                "x": 0.6203,
                "y": 0.336,
                "w": 0.2856,
                "h": 0.0285
              }
            },
            {
              "id": "I-1-f2",
              "kind": "text",
              "label": "b) A folyó, amely Szegednél a Tiszába ömlik:",
              "pdfRect": {
                "page": 1,
                "x": 0.6203,
                "y": 0.374,
                "w": 0.2856,
                "h": 0.0285
              }
            },
            {
              "id": "I-1-f3",
              "kind": "text",
              "label": "c) Az ország, amelynek fővárosa Pozsony:",
              "pdfRect": {
                "page": 1,
                "x": 0.6203,
                "y": 0.412,
                "w": 0.2856,
                "h": 0.0285
              }
            }
          ],
          "scoring": {
            "rules": [
              {
                "id": "r1",
                "points": 1,
                "fieldIds": [
                  "I-1-f1"
                ],
                "answer": {
                  "kind": "text",
                  "accepted": [
                    "Kékes",
                    "Kékes-tető"
                  ],
                  "normalize": {
                    "ignoreDiacritics": true,
                    "ignorePunctuation": true
                  }
                }
              },
              {
                "id": "r2",
                "points": 1,
                "fieldIds": [
                  "I-1-f2"
                ],
                "answer": {
                  "kind": "text",
                  "accepted": [
                    "Maros"
                  ],
                  "normalize": {
                    "ignoreDiacritics": true,
                    "ignorePunctuation": true
                  }
                }
              },
              {
                "id": "r3",
                "points": 1,
                "fieldIds": [
                  "I-1-f3"
                ],
                "answer": {
                  "kind": "text",
                  "accepted": [
                    "Szlovákia"
                  ],
                  "normalize": {
                    "ignoreDiacritics": true,
                    "ignorePunctuation": true
                  }
                }
              }
            ]
          },
          "explanation": "Kékes (1014 m, Mátra); a Maros Szegednél ömlik a Tiszába; Pozsony Szlovákia fővárosa.",
          "hints": [
            "Képzeld el Magyarország domborzati térképét: hol a legsötétebb barna folt?"
          ],
          "pdfRect": {
            "page": 1,
            "x": 0.0941,
            "y": 0.2955,
            "w": 0.8119,
            "h": 0.1569
          }
        }
      ]
    },
    {
      "id": "II",
      "title": "II. feladatlap",
      "timeLimitMinutes": 100,
      "maxPoints": 11,
      "instructions": "A II. feladatlap megoldásához használhatja a középiskolai atlaszt és a zsebszámológépet; a számítások menetét is írja le!",
      "tasks": [
        {
          "id": "II-1",
          "number": "1.",
          "type": "multiple_choice",
          "text": "Melyik kőzet keletkezik vulkáni működés során, a felszínre ömlő lávából? Írja a helyes válasz betűjelét a kijelölt helyre!",
          "maxPoints": 1,
          "topics": [
            "kőzetburok",
            "világ",
            "kőzetek"
          ],
          "fields": [
            {
              "id": "II-1-f1",
              "kind": "choice",
              "label": "Betűjel:",
              "options": [
                {
                  "value": "A",
                  "label": "gránit"
                },
                {
                  "value": "B",
                  "label": "bazalt"
                },
                {
                  "value": "C",
                  "label": "mészkő"
                },
                {
                  "value": "D",
                  "label": "homokkő"
                }
              ],
              "pdfRect": {
                "page": 2,
                "x": 0.7883,
                "y": 0.2928,
                "w": 0.1176,
                "h": 0.0285
              }
            }
          ],
          "scoring": {
            "rules": [
              {
                "id": "r1",
                "points": 1,
                "fieldIds": [
                  "II-1-f1"
                ],
                "answer": {
                  "kind": "choice",
                  "correct": [
                    "B"
                  ]
                }
              }
            ]
          },
          "explanation": "A bazalt kiömlési (vulkáni) magmás kőzet; a gránit mélységi magmás kőzet, a mészkő és a homokkő üledékes kőzet.",
          "pdfRect": {
            "page": 2,
            "x": 0.0941,
            "y": 0.1579,
            "w": 0.8119,
            "h": 0.1753
          }
        },
        {
          "id": "II-2",
          "number": "2.",
          "type": "calculation",
          "text": "Egy alföldi településen a felszín közelében a kőzetek hőmérséklete 11 °C, a geotermikus gradiens 5 °C / 100 m. Hány °C-os a kőzet 1500 m mélységben?",
          "maxPoints": 3,
          "topics": [
            "kőzetburok",
            "Magyarország",
            "geotermikus gradiens"
          ],
          "fields": [
            {
              "id": "II-2-w",
              "kind": "work",
              "label": "Számítás:",
              "pdfRect": {
                "page": 2,
                "x": 0.0941,
                "y": 0.4283,
                "w": 0.8119,
                "h": 0.2019
              }
            },
            {
              "id": "II-2-f1",
              "kind": "number",
              "label": "A kőzet hőmérséklete:",
              "unit": "°C",
              "pdfRect": {
                "page": 2,
                "x": 0.6472,
                "y": 0.6398,
                "w": 0.2016,
                "h": 0.0285
              }
            }
          ],
          "scoring": {
            "steps": [
              {
                "id": "s1",
                "points": 1,
                "description": "A mélység 100 méterekben: 1500 m = 15 × 100 m.",
                "auto": {
                  "fieldIds": [
                    "II-2-w"
                  ],
                  "alternatives": [
                    [
                      [
                        "15"
                      ]
                    ]
                  ]
                }
              },
              {
                "id": "s2",
                "points": 1,
                "description": "A hőmérséklet-emelkedés: 15 · 5 °C = 75 °C.",
                "auto": {
                  "fieldIds": [
                    "II-2-w"
                  ],
                  "alternatives": [
                    [
                      [
                        "75"
                      ]
                    ]
                  ]
                }
              }
            ],
            "rules": [
              {
                "id": "r1",
                "points": 1,
                "fieldIds": [
                  "II-2-f1"
                ],
                "answer": {
                  "kind": "number",
                  "accepted": [
                    86
                  ]
                }
              }
            ]
          },
          "explanation": "A hőmérséklet 100 méterenként 5 °C-kal nő: 1500 m-en 15 · 5 = 75 °C-kal melegebb, azaz 11 + 75 = 86 °C.",
          "hints": [
            "Először számold ki, hányszor 100 méter az 1500 méter."
          ],
          "pdfRect": {
            "page": 2,
            "x": 0.0941,
            "y": 0.3498,
            "w": 0.8119,
            "h": 0.3303
          }
        },
        {
          "id": "II-3",
          "number": "3.",
          "type": "calculation",
          "text": "Budapesten (UTC+1) délelőtt 10 óra van. Hány óra van ekkor New Yorkban (UTC−5)?",
          "maxPoints": 2,
          "topics": [
            "kozmikus környezet",
            "világ",
            "időszámítás"
          ],
          "fields": [
            {
              "id": "II-3-w",
              "kind": "work",
              "label": "Számítás:",
              "pdfRect": {
                "page": 3,
                "x": 0.0941,
                "y": 0.145,
                "w": 0.8119,
                "h": 0.2019
              }
            },
            {
              "id": "II-3-f1",
              "kind": "number",
              "label": "Az idő New Yorkban:",
              "unit": "óra",